{
  "$schema": "../../samples/contract/v1/schemas/sample-evidence.schema.json",
  "format": "honua.sdk.sample-evidence.v1",
  "schemaVersion": 1,
  "sampleId": "service-explorer",
  "lane": "live",
  "status": "executed",
  "reason": null,
  "observedAt": "2026-08-25T14:23:03.527Z",
  "authMode": "anonymous",
  "sdk": {
    "package": "@honua/sdk-js",
    "version": "0.1.7-beta.0",
    "gitCommit": "2006b8f84565bd7f79ff7a91d4145d8e9e7edaf0"
  },
  "source": {
    "provider": "esri-sampleserver6-and-pygeoapi-demo",
    "identity": "canonical-anonymous-geoservices+canonical-anonymous-ogc-features",
    "endpoint": "https://demo.pygeoapi.io/master",
    "deploymentVersion": null,
    "dataVersion": null
  },
  "provenance": {
    "sourceId": "canonical-anonymous-geoservices+canonical-anonymous-ogc-features",
    "observedAt": "2026-08-25T14:23:03.527Z",
    "validAt": null,
    "state": "live",
    "attribution": "Esri sample services and the pygeoapi development team."
  },
  "semantics": {
    "operation": "dual-protocol-inspect-plan-query",
    "outcome": "geoservices-and-ogc-plans-executed",
    "itemCount": 2,
    "assertions": [
      "credential-free-fixed-https-endpoints",
      "same-origin-path-confined-requests",
      "bounded-request-and-response-budgets",
      "geoservices-feature-service-inspected",
      "ogc-features-conformance-inspected",
      "strict-query-plans-accepted",
      "one-result-per-protocol-returned"
    ]
  },
  "timing": {
    "totalMs": 2646.387823,
    "firstSuccessfulInteractionMs": 507.30822099999995
  },
  "degradation": {
    "state": "none",
    "reasons": []
  },
  "artifacts": [
    {
      "kind": "producer-generator",
      "path": "examples/service-explorer/live-evidence.mjs",
      "sha256": "a8c67405185e2c0296d99892c7365a9b49d6cd441a1f645a94f41b5de92a3816"
    }
  ]
}
