{
  "format": "honua.sdk.sample-evidence.v1",
  "schemaVersion": 1,
  "sampleId": "imagery-cog-quickstart",
  "lane": "live",
  "status": "executed",
  "reason": null,
  "observedAt": "2026-10-09T07:42:30.408Z",
  "authMode": "anonymous",
  "sdk": {
    "package": "@honua/sdk-js",
    "version": "0.1.14",
    "gitCommit": "0796bf218f077647e5b4aaf06152cf16aefeeea6"
  },
  "source": {
    "provider": "Element 84 Earth Search",
    "identity": "S2B_21WWV_20260706_0_L2A",
    "endpoint": "https://earth-search.aws.element84.com/v1/collections/sentinel-2-l2a/items/S2B_21WWV_20260706_0_L2A",
    "deploymentVersion": null,
    "dataVersion": "\"c742ab386c2b9f2bc5264ff36a15b50f-6\""
  },
  "provenance": {
    "sourceId": "sentinel-2-l2a/S2B_21WWV_20260706_0_L2A/visual",
    "observedAt": "2026-10-09T07:42:30.408Z",
    "validAt": "2026-07-06T16:02:45.822000Z",
    "state": "live",
    "attribution": "ESA; Sinergise; AWS; Element 84"
  },
  "semantics": {
    "operation": "stac-direct-cog-inspect-read",
    "outcome": "classified-inspected-and-bounded-window-decoded",
    "itemCount": 1,
    "assertions": [
      "stac-media-type-classified-cog",
      "pinned-prefix-and-validator-match",
      "inspection-semantics-match-contract",
      "all-sdk-asset-responses-are-exact-206-ranges",
      "decoded-window-is-bounded"
    ]
  },
  "timing": {
    "totalMs": 2757.66345,
    "firstSuccessfulInteractionMs": 2757.66345
  },
  "degradation": {
    "state": "none",
    "reasons": []
  },
  "artifacts": [
    {
      "kind": "producer-generator",
      "path": "scripts/cog-live-evidence.mjs",
      "sha256": "18cc960be62120d810273226d0e30a206a4a2f77a230c6479c03ebfa9c90dfac"
    }
  ],
  "cog": {
    "contractPath": "test/fixtures/cog/public-earth-search-sentinel-2.json",
    "contractSha256": "4be1e672eb329feb055438b35ccf5105318ddaa4f2bfe2bccb4e7bc461ee0c2c",
    "prefix": {
      "contentRange": "bytes 0-63/42399590",
      "etag": "\"c742ab386c2b9f2bc5264ff36a15b50f-6\"",
      "sha256": "fd55271d3154514b178327d0baef7d5c6b595d3a75fbda9e666941c65863452e"
    },
    "classification": {
      "candidateId": "S2B_21WWV_20260706_0_L2A:visual",
      "confidence": "medium",
      "mediaType": "image/tiff;application=geotiff;profile=cloud-optimized",
      "evidence": [
        {
          "kind": "media-type",
          "value": "image/tiff;application=geotiff;profile=cloud-optimized",
          "supports": [
            "cog"
          ]
        },
        {
          "kind": "role",
          "value": "visual"
        },
        {
          "kind": "extension",
          "value": "https://stac-extensions.github.io/projection/v1.1.0/schema.json"
        },
        {
          "kind": "extension",
          "value": "https://stac-extensions.github.io/raster/v1.1.0/schema.json"
        },
        {
          "kind": "probe",
          "value": "blocked-cross-origin"
        }
      ]
    },
    "inspection": {
      "width": 10980,
      "height": 10980,
      "crs": "EPSG:32621",
      "bands": [
        {
          "index": 1,
          "dataType": "uint8",
          "name": "red",
          "colorInterpretation": "red",
          "nodata": 0
        },
        {
          "index": 2,
          "dataType": "uint8",
          "name": "green",
          "colorInterpretation": "green",
          "nodata": 0
        },
        {
          "index": 3,
          "dataType": "uint8",
          "name": "blue",
          "colorInterpretation": "blue",
          "nodata": 0
        }
      ],
      "resolution": {
        "x": 10,
        "y": 10,
        "unit": "metre"
      },
      "overviewDecimations": [
        2,
        4,
        8,
        16
      ],
      "validator": "etag:\"c742ab386c2b9f2bc5264ff36a15b50f-6\""
    },
    "read": {
      "request": {
        "x": 5000,
        "y": 5000,
        "width": 256,
        "height": 256,
        "bands": [
          1,
          2,
          3
        ],
        "sampling": {
          "width": 16,
          "height": 16,
          "overviewDecimation": 16,
          "resampling": "bilinear"
        }
      },
      "width": 16,
      "height": 16,
      "sampleSha256": "ef115a0e0c15cdc41958ca46b5b14b456115f4baec5e3ca68599d2a8f435e3b8"
    },
    "transfer": {
      "requests": 13,
      "bytesFetched": 75652,
      "metadataRequests": 12,
      "metadataBytes": 6322,
      "windowRequests": 1,
      "windowBytes": 69330,
      "ranges": [
        {
          "sequence": 1,
          "purpose": "metadata",
          "offset": 0,
          "length": 1024,
          "bytesReceived": 1024,
          "outcome": "success",
          "status": 206,
          "contentRange": "bytes 0-1023/42399590",
          "validator": "etag:\"c742ab386c2b9f2bc5264ff36a15b50f-6\""
        },
        {
          "sequence": 2,
          "purpose": "metadata",
          "offset": 8,
          "length": 1024,
          "bytesReceived": 1024,
          "outcome": "success",
          "status": 206,
          "contentRange": "bytes 8-1031/42399590",
          "validator": "etag:\"c742ab386c2b9f2bc5264ff36a15b50f-6\""
        },
        {
          "sequence": 3,
          "purpose": "metadata",
          "offset": 1216,
          "length": 6,
          "bytesReceived": 6,
          "outcome": "success",
          "status": 206,
          "contentRange": "bytes 1216-1221/42399590",
          "validator": "etag:\"c742ab386c2b9f2bc5264ff36a15b50f-6\""
        },
        {
          "sequence": 4,
          "purpose": "metadata",
          "offset": 1304,
          "length": 24,
          "bytesReceived": 24,
          "outcome": "success",
          "status": 206,
          "contentRange": "bytes 1304-1327/42399590",
          "validator": "etag:\"c742ab386c2b9f2bc5264ff36a15b50f-6\""
        },
        {
          "sequence": 5,
          "purpose": "metadata",
          "offset": 1328,
          "length": 48,
          "bytesReceived": 48,
          "outcome": "success",
          "status": 206,
          "contentRange": "bytes 1328-1375/42399590",
          "validator": "etag:\"c742ab386c2b9f2bc5264ff36a15b50f-6\""
        },
        {
          "sequence": 6,
          "purpose": "metadata",
          "offset": 1376,
          "length": 64,
          "bytesReceived": 64,
          "outcome": "success",
          "status": 206,
          "contentRange": "bytes 1376-1439/42399590",
          "validator": "etag:\"c742ab386c2b9f2bc5264ff36a15b50f-6\""
        },
        {
          "sequence": 7,
          "purpose": "metadata",
          "offset": 1440,
          "length": 30,
          "bytesReceived": 30,
          "outcome": "success",
          "status": 206,
          "contentRange": "bytes 1440-1469/42399590",
          "validator": "etag:\"c742ab386c2b9f2bc5264ff36a15b50f-6\""
        },
        {
          "sequence": 8,
          "purpose": "metadata",
          "offset": 1470,
          "length": 1024,
          "bytesReceived": 1024,
          "outcome": "success",
          "status": 206,
          "contentRange": "bytes 1470-2493/42399590",
          "validator": "etag:\"c742ab386c2b9f2bc5264ff36a15b50f-6\""
        },
        {
          "sequence": 9,
          "purpose": "metadata",
          "offset": 2630,
          "length": 6,
          "bytesReceived": 6,
          "outcome": "success",
          "status": 206,
          "contentRange": "bytes 2630-2635/42399590",
          "validator": "etag:\"c742ab386c2b9f2bc5264ff36a15b50f-6\""
        },
        {
          "sequence": 10,
          "purpose": "metadata",
          "offset": 2636,
          "length": 1024,
          "bytesReceived": 1024,
          "outcome": "success",
          "status": 206,
          "contentRange": "bytes 2636-3659/42399590",
          "validator": "etag:\"c742ab386c2b9f2bc5264ff36a15b50f-6\""
        },
        {
          "sequence": 11,
          "purpose": "metadata",
          "offset": 3122,
          "length": 1024,
          "bytesReceived": 1024,
          "outcome": "success",
          "status": 206,
          "contentRange": "bytes 3122-4145/42399590",
          "validator": "etag:\"c742ab386c2b9f2bc5264ff36a15b50f-6\""
        },
        {
          "sequence": 12,
          "purpose": "metadata",
          "offset": 3392,
          "length": 1024,
          "bytesReceived": 1024,
          "outcome": "success",
          "status": 206,
          "contentRange": "bytes 3392-4415/42399590",
          "validator": "etag:\"c742ab386c2b9f2bc5264ff36a15b50f-6\""
        },
        {
          "sequence": 13,
          "purpose": "window",
          "offset": 3622,
          "length": 69330,
          "bytesReceived": 69330,
          "outcome": "success",
          "status": 206,
          "contentRange": "bytes 3622-72951/42399590",
          "validator": "etag:\"c742ab386c2b9f2bc5264ff36a15b50f-6\""
        }
      ]
    },
    "freshness": {
      "acquisitionAt": "2026-07-06T16:02:45.822000Z",
      "probedAt": "2026-10-09T07:42:30.408Z",
      "validUntil": "2026-10-17T07:42:30.408Z",
      "cadenceDays": 7
    }
  }
}
