{
  "format": "honua.sdk.sample-evidence.v1",
  "schemaVersion": 1,
  "sampleId": "migration-workbench",
  "lane": "live",
  "status": "executed",
  "reason": null,
  "observedAt": "2026-08-04T21:45:39.533Z",
  "authMode": "none",
  "sdk": {
    "package": "@honua/sdk-js",
    "version": "0.1.2-beta.0",
    "gitCommit": "9fa64f1c5344fe8c85ecbdb6b8d82bb2802a6797"
  },
  "source": {
    "provider": "honua-migrate-cli",
    "identity": "arcgis-source-app:v1",
    "endpoint": null,
    "deploymentVersion": null,
    "dataVersion": null
  },
  "provenance": {
    "sourceId": "arcgis-source-app:v1",
    "observedAt": "2026-08-04T21:45:39.533Z",
    "validAt": null,
    "state": "live",
    "attribution": "Honua-authored arcgis-source-app repository fixture; no third-party sample source is reproduced."
  },
  "semantics": {
    "operation": "migration-workbench-deterministic-cli-replay",
    "outcome": "codemod:auto=9,manual=0,total=9",
    "itemCount": 9,
    "assertions": [
      "readiness=\"ready\"",
      "autoMigratedCallSites=9",
      "manualCallSites=0",
      "totalCodemodScopedCallSites=9",
      "manualInterventionRatio=0",
      "behaviorProofPassed=true",
      "behaviorAssertionCount=23",
      "patchApplyCheckPassed=true",
      "patchTargetTreeEqual=true",
      "artifactCount=6",
      "sourceUpload=false",
      "credentialsRequired=false"
    ]
  },
  "timing": {
    "totalMs": 3572,
    "firstSuccessfulInteractionMs": 3572
  },
  "degradation": {
    "state": "none",
    "reasons": []
  },
  "artifacts": [
    {
      "kind": "producer-generator",
      "path": "scripts/migration-workbench-live-evidence.mjs",
      "sha256": "9662644ef5154fc918e014984b4fbfaf6b48f9320eecd0aba01b05eb57ab20ea"
    }
  ]
}
