{
  "format": "honua.sdk.sample-evidence.v1",
  "schemaVersion": 1,
  "sampleId": "maplibre-quickstart",
  "lane": "live",
  "status": "executed",
  "reason": null,
  "observedAt": "2026-07-19T08:03:30.402Z",
  "authMode": "anonymous",
  "sdk": {
    "package": "@honua/sdk-js",
    "version": "0.1.0-beta.0",
    "gitCommit": "d58006db847811417a5845b61bb6d30f8bd7ac1f"
  },
  "source": {
    "provider": "esri-living-atlas",
    "identity": "geoservices-feature-service:0",
    "endpoint": "https://services.arcgis.com/P3ePLMYs2RVChkJx/arcgis/rest/services/2020_Census_State_Apportionment/FeatureServer/0",
    "deploymentVersion": null,
    "dataVersion": null
  },
  "provenance": {
    "sourceId": "geoservices-feature-service:0",
    "observedAt": "2026-07-19T08:03:31.521Z",
    "validAt": null,
    "state": "live",
    "attribution": "States 2020 Apportionment - U.S. House of Representatives Seats"
  },
  "semantics": {
    "operation": "first-map-anonymous-public-endpoint",
    "outcome": "map-popup-filter-plan-ready",
    "itemCount": 1,
    "assertions": [
      "protocol=\"geoservices-feature-service\"",
      "sourceId=\"0\"",
      "attribution=\"States 2020 Apportionment - U.S. House of Representatives Seats\"",
      "freshness=\"observed\"",
      "cacheStatus=\"miss\"",
      "degradationCount=0",
      "planFingerprint=\"sha256:0885ae4a8d3e0e73be390693ccbb07052cfb9db059ade26c6515c73212e058a7\"",
      "mode=\"Anonymous live\"",
      "credentialsSent=false",
      "unexpectedNetworkRequests=0",
      "cleanupBudgetMet=true"
    ]
  },
  "timing": {
    "totalMs": 777,
    "firstSuccessfulInteractionMs": 777
  },
  "degradation": {
    "state": "none",
    "reasons": []
  },
  "artifacts": [
    {
      "kind": "producer-generator",
      "path": "scripts/first-map-live-evidence.mjs",
      "sha256": "d103c968b016dc2a320bf799df60733669ff86252a12f8cd6987ea10ca1f1459"
    },
    {
      "kind": "live-screenshot",
      "path": "samples/evidence/maplibre-quickstart/runs/d8f5fd4d-ca90-4eb3-814c-856cb72b8f80/artifacts/live-evidence.png",
      "sha256": "f49b7ff9c35730f0fc0620ca2d5f69ea6e5b48fa314d3b5603bd7b3c43fca2f2"
    }
  ]
}
